content,tag,awordlength,noofwords,avgwordlength,avgsentencelength,linkdensity,fontSize,fontWeight,left,top,width,height,text,atext
MC,H1,1,6,7,6,0,29,400,201,100,1068,38,1971–72 georgetown hoyas men's basketball team,
MC,P,11,63,4,63,0,14,400,201,182,1068,112,the  represented  during the 1971-72   season.  coached them in his sixth and final season as head coach. the team was an independent and played its home games at  on the georgetown campus in . it finished the season with a record of 3-23 and therefore was not ranked in the top 20 in the  or  at any time and had no post-season play.,georgetown universityncaa division icollege basketballjohn mageemcdonough gymnasiumwashington d.c.associated press pollcoaches' poll[1][2]
MC,SPAN,1,2,6,2,1,21,400,201,454,121,24,season recap,
MC,P,7,99,5,99,0,14,400,201,487,1068,134,art white thought at the time to have been the greatest player in georgetown history had left the team at the end of the  because of academic difficulties and he sat out this season entirely. magees relationship with his players had begun to unravel the previous year when the 1970-71 team had followed up the  appearance in the  with a disappointing performance that magee blamed on the players – including the once highly regarded white – although he reserved praise for then-junior  . in all georgetown lost all but two of its top nine scorers from the 1970-71 season.,forwardprevious season[3][4]1969-70 team's1970 national invitation tournamentforwardmike laughna[5]
MC,P,4,191,5,191,0,14,400,201,629,1068,179,magees relationship with his players continued to deteriorate this year but that and the loss of scorers were not the 1971-72 squads only problems.  robert sigholtz had committed the hoyas to a schedule that included only 10 home games and forced the team to play nine straight road games between december 13 1971 and january 22 1972. magee working in the last year of his contract with no sign of the university offering an extension openly feuded with sigholtz over this schedule and over whether or not sigholz had provided magee with an adequate recruiting budget which totaled only 5140. after laughna now a senior and the teams captain said in an interview with  that georgetown did not seem to spend very much of the revenue it earned from the basketball team on the basketball program itself sigholtz responded with an ineffective late-season news conference that failed to address laughnas comments and deflected criticism onto magee blaming him for the unfavorable schedule and for not using fully the recruiting tools he had available to him. observers took away little more than the impression that the georgetown athletic department was deeply troubled.,athletic director$the washington post[5]
MC,P,5,95,5,95,0,14,400,201,815,1068,90,under these difficult circumstances  put in a creditable performance on the court during the otherwise dismal season with 25 points and 11 rebounds at  22 points and 12 rebounds three days later at  and 24 points and 15 rebounds against  he passed jim barry as the top scorer in georgetown history on march 4 1972 during a loss at  in the final game of the season and of his collegiate career and finished with 1234 career points. despite his efforts the team won only one game each in december january and february.,mike laughnatexassan franciscogeorge washingtonboston college[5]
MC,P,3,57,5,57,0,14,400,201,911,1068,67,the 1971-72 team's .115 winning percentage was the worst in  history and well below the previous worst of .238 set by the 5-16 team of . magee resigned two weeks after sigholtzs news conference after a six-year tenure as head coach which saw two winning seasons and one post-season tournament appearance. sigholtz resigned nine days after magee.,georgetown men's basketball1930-31[5][6]
MC,P,8,106,5,106,0,14,400,201,986,1068,112,although it was not known at the time the 1971-72 season brought a 25-year stretch of mostly undistinguished basketball at georgetown to an end. although the team had appeared in the  in  and  between the  and the end of this season georgetown had posted an overall record under .500 and its total of 296 wins during those 25 seasons was the lowest among the 32  universities playing division i college basketball in the . the team also had had no  appearances since . the arrival of  as head coach the following season however would begin georgetowns rise to the status of national basketball power.,national invitation tournament195319701947-48 seasoncatholicunited statesncaa tournament1943john thompson jr.[3]
MC,H1,1,2,8,2,1,29,400,201,-566,1068,38,christine tamblyn,
MC,P,2,15,5,15,0,14,400,201,-485,1068,22,(july 12 1951 – january 1 1998) was an american feminist  critic and educator.,media artist[1]
MC,SPAN,1,4,5,4,0,21,400,201,-280,220,24,early life and education,
MC,P,11,137,5,137,0,14,400,201,-247,1068,134,tamblyn was born in 1951 in waukegan illinois and attended a catholic girls' school in mundelein carmel high school for girls. she was very shy as a child and never learned to ride a bike or drive a car. she moved to chicago in 1968 or 1969 and began to audit courses at the  while working as an administrative assistant for an insurance company. around 1973 she began undergraduate studies at the  where she focused on video and performance because of what she saw as their links to everyday life. her aesthetic in this period was deeply influenced by the work of  and the  of the late 1950s and early 1960s as well as by the chicago imagist school of videomakers which included her teacher . she taught graduate-level courses in video while still an undergraduate.,university of chicagoschool of the art institute of chicagoallan kaprowhappeningsphil morton[2]
MC,P,10,102,4,102,0,14,400,201,-105,1068,90,on graduating from saic in 1979 tamblyn moved to new york and pursued her performance work in east village spaces. this was a difficult time in her life as she lacked access to the advanced equipment she needed to produce her work. she taught for a while at the  and held some clerical jobs. by the early 1980s tamblyn had become increasingly involved in curatorial work. she decided to go to graduate school at the  where she was able to study with kaprow as well as with the conceptual and performance artists  and . she received her m.f.a. degree in 1986.,school of visual artsuniversity of california san diegoeleanor antindavid antin
MC,P,6,43,5,43,0,14,400,201,-9,1068,45,in 1994 tamblyn was hired as an assistant professor at  miami. two years later she took up an assistant professorship in the department of studio art at the  where she began to lay the foundation of the department's digital arts curriculum.,florida international universityuniversity of california irvine
MC,P,1,33,5,33,0,14,400,201,43,1068,45,a few months before her death tamblyn moved back to san francisco. she died there of breast cancer on new year's day 1998. her archive is held by the university of california irvine.,
MC,SPAN,1,4,5,4,0,21,400,201,111,217,24,art career and teaching,
MC,P,3,153,6,153,0,14,400,201,144,1068,157,as a visual artist tamblyn worked in performance and new media and was in the forefront of those experimenting with video and computer technologies for the creation of . indeed along with artists such as  tamblyn argued that the emergence of computer art represented the apogee of the 20th century's conceptual art movement. many of tamblyn's works were autobiographically inflected including the cd-rom projects  (1993)  (1995)—both of which have been shown widely—and the posthumous  (1998). by including personal materials such as childhood journals tamblyn underlined the fact that interactive media do not provide a space of absolute freedom for the viewer but instead offer a structure that complexly links viewer to artist. tamblyn's work was exhibited during her lifetime at the institute of contemporary arts (london) pacific film archives (california) san francisco exploratorium wexner center for contemporary art (ohio); walter phillips gallery in the banff centre (canada) and numerous other international venues.,conceptual art[3]timothy binkley[4][5][6]
MC,P,2,54,5,54,0,14,400,201,308,1068,67,tamblyn liked to work with other artists and  was a collaboration with two of her sfsu students  and paul tompkins. an interactive multimedia essay that channels contradictory attitudes towards technology in art it was both an alternative kind of artist's book and one of the first cd-roms created and produced by a woman artist.,marjorie franklin[7]
MC,P,1,101,5,101,0,14,400,201,382,1068,90,"tamblyn's second cd-rom  which set up comparisons between the life stories of ten prominent women won a number of awards including finalist award at the 1996 new york exposition of short film and video an honorable mention in the 1996 ""new voices new visions"" contest sponsored by  magazine and first prize in the 1997 international festival of the image in colombia. in 1997 tamblyn was commissioned by the national endowment for the arts  to produce a new cd-rom . this catalogue of her own writing and experience was nearly complete when she died and was finished by friends and colleagues.",[8]
MC,P,2,60,5,60,0,14,400,201,479,1068,67,in the 1980s tamblyn began working with feminist performance artists. in 1984 she was invited by the los angeles  to create  a work that challenged the anti-pornography position held by some feminists. some of her later writing similarly upholds the ways that sexually explicit imagery can serve as an antidote to certain idealized and prescriptive versions of female sexuality.,woman's building[9]
MC,P,15,51,5,51,0,14,400,201,553,1068,67,in 1984 tamblyn moved to san francisco and began teaching at  as lecturer and coordinator of their graduate program a position she held until 1996. over the next few years she also taught for short periods at the  (1988-1990)  (1989)  (1990) and the  (1990-1993) where she was a visiting assistant professor.,san francisco state universitysan francisco art instituteuniversity of california santa cruzmills collegeuniversity of california berkeley
MC,P,4,150,5,150,0,14,400,201,627,1068,134,while living in the bay area she wrote for several major art publications including  (as contributing editor)  (as editor) and  (as correspondent).  by this point she had been writing art criticism and exhibition catalogs for most of a decade and had already served as the video and performance editor for the  journal from 1977 to 1979. tamblyn was a prolific critic going on to write dozens of reviews and a number of essays for   and  in addition to the above publications. her writing often addressed issues of gender exclusion in new media censorship of artists and declining arts funding. she was known for producing finished articles from a first draft without the need for revisions an ability she attributed to her lifelong habit of daily journal writing. twice in 1987 and 1990 her writing was recognized by the john mccarron art writing award from artspace in san francisco.,art newsnew art examinerafterimageleonardo[8]
MC,SPAN,1,2,10,2,1,21,400,201,784,197,24,selected publications,
MC,LI,1,12,6,12,0,14,400,223,816,1045,22,remote control: the electronic transference.  m. calvert and j. terry eds. 1997.,
MC,LI,1,10,3,10,0,14,400,223,840,1045,22,the hair of the dog that bit us. . 1994.,
MC,LI,2,9,8,9,0,14,400,223,864,1045,45,real grumblings and pseudo-science: a holo-grammatological augmentation. . 1993.,jim pomeroy
MC,LI,1,14,5,14,0,14,400,223,910,1045,22,boys club craft hut carnival or cyberspace?: the san francisco art scene. . 1993.,
MC,LI,3,6,5,6,1,14,400,223,934,1045,22,endangered species. . 1992. (on ),lynn hershman leeson
MC,LI,1,10,6,10,0,14,400,223,958,1045,22,no more nice girls: recent transgressive feminist art. . 1991.,
MC,LI,1,12,5,12,0,14,400,223,981,1045,22,the river of swill: feminist art sexual codes and censorship. . 1990.,
MC,LI,1,17,6,17,0,14,400,223,1005,1045,45,significant others: social documentary as personal portraiture in women's video of the '80s. . aperture press 1990.,
MC,LI,1,7,5,7,0,14,400,223,1051,1045,22,computer art as conceptual art  49:3. 1990.,
MC,LI,1,8,6,8,0,14,400,223,1075,1045,22,spectacular visions: video art. . midmarch press 1989.,
MC,LI,1,10,8,10,0,14,400,223,1099,1045,22,cybernetic technologies: neither utopian templates nor dystopian harbingers. . 1989.,
MC,H1,1,3,8,3,0,29,400,201,-166,1068,38,rendezvous pitch maneuver,
MC,P,7,115,4,115,0,14,400,201,-85,1068,157,the  (rpm) popularly called the  was a maneuver performed by the  as it  with the  (iss) prior to docking. the shuttle performed a backflip that exposed its  to the crew of the iss that made photographs of it. based on the information gathered during the rendezvous pitch maneuver the mission team could decide that the orbiter was not safe for re-entry. they may have then decided either to wait on the iss for a  or attempt  to repair the heat shield and secure the safe re-entry of the orbiter. this was a standard procedure recommended by  for all space shuttles docking to the international space station after a damaged heat shield caused the .,space shuttlerendezvousedinternational space stationheat-shieldrescue missionextra-vehicular activitycaibcolumbia disaster
MC,B,1,3,8,3,0,14,700,550,-82,185,16,rendezvous pitch maneuver,
MC,SPAN,1,2,10,2,1,21,400,201,430,204,24,maneuver description,
MC,P,4,175,4,175,0,14,400,201,463,1068,246,the name of the maneuver was based on the  and  lines that are used in the approach of the space station. r-bar or  is an imaginary line connecting the space station to the center of the earth. v-bar would be the  of the space station.the shuttle approached the station along the r-bar line and at a small distance from the iss usually around 600 feet (180 meters) the shuttle performed a slow 360°  during which it exposed its underside the heat shield to the iss. the crew inside the iss visually inspected and photographed the heat shield to determine whether or not it had been damaged during liftoff and ascent. this maneuver required skilled piloting as the shuttle  must fly very close to the iss without the station always in full view. after the maneuver is complete the shuttle flew from the r-bar to the v-bar a 90 degree angle change as seen from iss and then continued along the v-bar line to close in on the space station and eventually complete the docking.,r-barv-barearth radius vectorvelocity vector[1]pitchcommander[1]
MC,P,6,110,5,110,0,14,400,201,717,1068,112,"the rendezvous pitch maneuver was developed by nasa engineers steve walker mark schrock and jessica lopresti after the .  had sustained damage to its heat shield due to insulating foam breaking off the external tank and hitting the shield at liftoff. the damage was too great for the heat shield to protect the shuttle from the heat and structural strain of  causing it to break apart. for this reason the integrity of the heat shield had been a critical concern of  ever since. the maneuver was first performed by mission commander  on  which was one of space shuttle s two ""return to flight"" missions after the  sts-107 disaster.",space shuttle columbia disaster[2]atmospheric reentrynasaeileen collinssts-114[2]
MC,SPAN,1,7,7,7,0,21,400,201,851,588,24,photographers and photographic equipment used during rpms,
MC,SPAN,1,1,7,1,1,17,700,201,895,65,18,sts-114,
MC,P,11,54,5,54,0,14,400,201,925,1068,67,during  the rendezvous pitch maneuver was performed by commander  shortly before docking with the iss at 11:18  on july 28 2005 when  was photographed by commander  and flight engineer  of the iss  using handheld  digital cameras. on this occasion astronaut  undertook a precautionary  to remove protruding gap fillers prior to re-entry.,sts-114eileen collinsutcspace shuttle discoverysergei krikalevjohn l. phillipsexpedition 11kodak 760 dcsstephen robinsonspacewalk
MC,SPAN,1,1,7,1,1,17,700,201,1011,65,18,sts-115,
MC,P,2,10,4,10,0,14,400,201,1041,1068,22,during  ' belly was photographed by the iss .,sts-115atlantisexpedition 13
MC,SPAN,1,1,7,1,1,17,700,201,1083,65,18,sts-116,
MC,P,4,16,4,16,0,14,400,201,1112,1068,22,during   commanded by  performed the rpm and was photographed by the iss .,sts-116mark l. polanskyexpedition 14
MC,SPAN,1,1,7,1,1,17,700,201,1154,65,18,sts-117,
MC,P,4,28,4,28,0,14,400,201,1183,1068,45,during the rpm of  performed by mission commander   and another member of  used 400mm and 800mm lenses for taking photos out of two windows of the iss.,sts-117rick sturckowsunita williamsexpedition 15
MC,SPAN,1,1,7,1,1,17,700,201,1247,65,18,sts-118,
MC,P,5,50,4,50,0,14,400,201,1277,1068,67,during  the rpm of  was photographed by . the maneuver was videotaped by  and photographed by  and  with 800mm and 400mm lenses. a focused inspection of a damaged portion of s heat shield was performed by the sts-118 crew later in the mission after ground engineers reviewed the rpm photographs.,sts-118endeavourexpedition 15clay andersonfyodor yurchikhinoleg kotov
MC,SPAN,1,1,7,1,1,17,700,201,1363,66,18,sts-120,
MC,P,4,10,4,10,0,14,400,201,1393,1068,22,crewmembers  and  photographed and videotaped the rpm of  during .,expedition 16clay andersonyuri malenchenkosts-120
MC,SPAN,1,1,7,1,1,17,700,201,1435,66,18,sts-121,
MC,P,4,32,4,32,0,14,400,201,1464,1068,45,during  the rendezvous pitch maneuver was performed at 14:02 utc on july 6 2006 when  was photographed by commander  and flight engineer  of the iss  using 400mm and 800mm lenses.,sts-121pavel vinogradovjeffrey williamsexpedition 13
MC,SPAN,1,1,7,1,1,17,700,201,1528,66,18,sts-122,
MC,P,7,66,4,66,0,14,400,201,1558,1068,90,"the  rpm occurred on february 9 2008.  from 16:24 to 16:31 utc  pilot  performed the rpm.  the rpm was photographed by expedition 16 crew members  and  with 400mm and 800mm lenses respectively from the  service module.  malenchenko had been directed to take extra images of the starboard  so an ""area of interest"" on the  could be evaluated.  some 300 images were expected to be captured.",sts-122alan g. poindexterpeggy whitsonyuri malenchenkozvezdaoms podthermal blanket[3]
MC,H1,1,5,7,5,0,40,400,306,-9835,680,96,android styling: common theme attributes,
MC,P,1,34,5,34,0,21,400,306,-9628,680,96,in the previous article in this series on android styling we looked at the difference between themes and styles and how themes allow you to write more flexible styles and layouts which isolate changes:,
MC,P,2,55,5,55,0,21,400,306,-9300,680,160,specifically we recommended using theme attributes to provide a point of indirection to resources so that you can vary them (e.g. in ). that is if you find yourself writing a direct resource reference (or worse yet a hardcoded value 😱) in a layout or style consider if you should use a theme attribute instead.,dark theme
MC,P,1,59,5,59,0,21,400,306,-8862,680,160,but what theme attributes are available to use? this post highlights the common ones that you should know about; those that come from material appcompat or the platform. this is not a complete list (for that i’d recommend browsing the attrs files linked below where they are defined) but these are the attributes that i use all the time.,
MC,H1,1,1,6,1,1,34,600,306,-8645,680,38,colors,
MC,P,6,22,4,22,0,21,400,306,-8590,680,96,many of these colors come from the  which defines semantic names for colors that you can use throughout your app ().,material color systemimplemented as theme attrs
MC,LI,1,7,5,7,0,21,400,336,-7740,650,35,the primary branding color for the app.,
MC,LI,1,16,5,16,0,21,400,336,-7693,650,67,the secondary branding color for the app usually a bright complement to the primary branding color.,
MC,LI,1,8,5,8,0,21,400,336,-7613,650,67,a color which contrasts against the named color.,
MC,LI,1,7,5,7,0,21,400,336,-7533,650,67,an alternate shade of the given color.,
MC,LI,1,12,5,12,0,21,400,336,-7454,650,67,a color for surfaces of components such as cards sheets and menus.,
MC,LI,1,5,5,5,0,21,400,336,-7374,650,35,the background for the screen.,
MC,LI,1,10,4,10,0,21,400,336,-7327,650,70,switches between  in the light themes  in the dark theme.,
MC,LI,1,5,5,5,0,21,400,336,-7244,650,35,a color for displaying errors.,
MC,P,1,3,6,3,0,21,400,306,-7176,680,32,other handy colors:,
MC,LI,1,9,6,9,0,21,400,336,-7112,650,67,the color applied to icons/controls in their normal state.,
MC,LI,1,11,6,11,0,21,400,336,-7032,650,67,the color applied to icons/controls in their activated state (e.g. checked).,
MC,LI,1,10,6,10,0,21,400,336,-6953,650,67,the color applied to control highlights (e.g. ripples list selectors).,
MC,LI,1,5,5,5,0,21,400,336,-6873,650,35,the most prominent text color.,
MC,LI,1,3,6,3,0,21,400,336,-6826,650,35,secondary text color.,
MC,H1,1,1,6,1,1,34,600,306,-6734,680,38,dimens,
MC,LI,1,6,5,6,0,21,400,336,-6678,650,35,standard (min) height for list items.,
MC,LI,1,5,4,5,0,21,400,336,-6630,650,35,the height of a toolbar.,
MC,H1,1,1,9,1,1,34,600,306,-6539,680,38,drawables,
MC,LI,1,9,7,9,0,21,400,336,-6483,650,67,a ripple/highlight for interactive items (also handy for foregrounds!!),
MC,LI,1,3,6,3,0,21,400,336,-6403,650,35,an unbounded ripple.,
MC,LI,1,13,5,13,0,21,400,336,-6356,650,67,a drawable that may be used as a vertical divider between visual elements.,
MC,LI,1,13,5,13,0,21,400,336,-6276,650,67,a drawable that may be used as a horizontal divider between visual elements.,
MC,H1,1,1,15,1,1,34,600,306,-6152,680,38,textappearances,
MC,P,4,44,4,44,0,21,400,306,-6097,680,131,material  a type scale — a discrete set of text styles that you should use throughout your app each of which is  as a theme attribute which can be set as a . check out the  to help generate a scale for different fonts.,definesprovidedmaterial type scale generator
MC,LI,1,5,5,5,0,21,400,336,-5338,650,35,defaults to light 96sp text.,
MC,LI,1,5,5,5,0,21,400,336,-5290,650,35,defaults to light 60sp text.,
MC,LI,1,5,5,5,0,21,400,336,-5243,650,35,defaults to regular 48sp text.,
MC,LI,1,5,5,5,0,21,400,336,-5195,650,35,defaults to regular 34sp text.,
MC,LI,1,5,5,5,0,21,400,336,-5147,650,35,defaults to regular 24sp text.,
MC,LI,1,5,5,5,0,21,400,336,-5100,650,35,defaults to medium 20sp text.,
MC,LI,1,5,5,5,0,21,400,336,-5052,650,35,defaults to regular 16sp text.,
MC,LI,1,5,5,5,0,21,400,336,-5005,650,35,defaults to medium 14sp text.,
MC,LI,1,5,5,5,0,21,400,336,-4957,650,35,defaults to regular 16sp text.,
MC,LI,1,5,5,5,0,21,400,336,-4909,650,35,defaults to regular 14sp text.,
MC,LI,1,5,5,5,0,21,400,336,-4862,650,35,defaults to regular 12sp text.,
MC,LI,1,7,5,7,0,21,400,336,-4814,650,35,defaults to medium all caps 14sp text.,
MC,LI,1,7,5,7,0,21,400,336,-4767,650,35,defaults to regular all caps 10sp text.,
MC,H1,1,1,5,1,1,34,600,306,-4675,680,38,shape,
MC,P,2,41,5,41,0,21,400,306,-4619,680,163,material employs a  which is  as theme attrs for small medium and large components. note that if you’re setting a shape appearance on a custom component you likely want to use a  as it’s background which understands and implements the shaping.,shape systemimplementedmaterialshapedrawable
MC,LI,1,12,5,12,0,21,400,336,-3591,650,67,used for buttons chips text fields etc. defaults to rounded 4dp corners.,
MC,LI,1,12,5,12,0,21,400,336,-3512,650,67,used for cards dialogs date pickers etc. defaults to rounded 4dp corners.,
MC,LI,1,12,5,12,0,21,400,336,-3432,650,67,used for bottom sheets etc. defaults to rounded 0dp corners (i.e. square!),
MC,H1,1,2,6,2,1,34,600,306,-3308,680,38,button styles,
MC,P,1,28,4,28,0,21,400,306,-3072,680,99,this might seem super specific but material defines three  of buttons:   and . mdc offers theme attrs that you can use to set the  of a :,containedtextoutlined
MC,LI,1,8,5,8,0,21,400,336,-2941,650,35,defaults to contained (or just omit the style).,
MC,LI,1,5,4,5,0,21,400,336,-2893,650,35,for a text style button.,
MC,LI,1,3,6,3,0,21,400,336,-2846,650,35,for outlined style.,
MC,H1,1,1,6,1,1,34,600,306,-2754,680,38,floats,
MC,LI,1,5,6,5,0,21,400,336,-2698,650,35,default disabled alpha for widgets.,
MC,LI,1,7,6,7,0,21,400,336,-2650,650,67,the alpha applied to the foreground elements.,
MC,LI,1,6,6,6,0,21,400,336,-2571,650,67,the alpha applied to secondary elements.,
MC,H1,1,4,5,4,0,34,600,306,-2447,680,38,app vs android namespace,
MC,P,1,124,5,124,0,21,400,306,-2391,680,368,you might have noticed that some attributes are referenced by  and others just by . this is because some are defined by the android platform and as such you need the  part to reference them by their namespace (just like with view attributes in layouts: ). those without come from static libraries (i.e. appcompat or mdc) which are compiled into your application so don’t need the namespace (similar to how you might use  in a layout). some elements are defined  in the platform and in a library e.g. . in these cases prefer the non-platform version as this can be used on all api levels i.e. they’re duplicated in a library precisely to backport them. in these cases i’ve listed the non-platform versions above.,
MC,H1,1,2,7,2,1,34,600,306,-1902,680,38,more resources,
MC,P,1,17,4,17,0,21,400,306,-1847,680,64,for a complete list of the theme attributes available to use go to the source of truth:,
MC,P,1,3,8,3,0,21,400,306,-1642,680,32,material design components:,
MC,H1,1,3,4,3,0,34,600,306,-1400,680,38,do it yourself,
MC,P,3,35,5,35,0,21,400,306,-1344,680,128,sometimes there isn’t a theme attribute which abstracts something you’d like to vary by theme. no worries… create your own! here’s an example from the  which shows a list of conference sessions in two screens.,google i/o app
MC,P,1,51,5,51,0,21,400,306,-650,680,128,they’re largely similar but the left screen must leave space for the sticky time headers while the right screen does not. we implemented this by abstracting where to align items behind a theme attribute so that we can vary them by theme and use the same layout across two different screens:,
